{
  "$schema": "https://json.schemastore.org/claude-code-plugin-manifest.json",
  "name": "rldyour-mcps",
  "version": "1.8.14",
  "description": "Транспортный слой MCP-серверов для маркетплейса rldyour-claudecode - все версии зафиксированы. 10 серверов: Serena, Sequential Thinking, Chrome DevTools, Context7, DeepWiki, Grep, shadcn, Dart/Flutter, Figma, OpenAI Docs.",
  "author": {
    "name": "Danil Silantyev (github:rldyourmnd), CEO NDDev",
    "url": "https://github.com/rldyourmnd"
  },
  "license": "AGPL-3.0-or-later",
  "homepage": "https://github.com/rldyourmnd/rldyour-claudecode/tree/main/plugins/rldyour-mcps",
  "repository": "https://github.com/rldyourmnd/rldyour-claudecode",
  "keywords": [
    "mcp",
    "transport",
    "rldyour",
    "serena",
    "github",
    "context7"
  ]
}
