{
  "$schema": "https://json.schemastore.org/claude-code-plugin-manifest.json",
  "name": "rldyour-flow",
  "version": "1.8.9",
  "description": "Автономный SDLC-воркфлоу для Claude Code: ry-init, ry-start, ry-newp, ry-review, ry-repair, ry-deploy, ry-sync + 6 reviewer subagents (architecture/quality/consistency/integration/verification/security) + flow-post-task-sync + instruction-docs-sync. SessionStart/PreToolUse/PostToolUse/Stop хуки advisory + non-blocking. Tracked AI context on main.",
  "author": {
    "name": "Danil Silantyev (github:rldyourmnd), CEO NDDev",
    "url": "https://github.com/rldyourmnd"
  },
  "license": "AGPL-3.0-or-later",
  "homepage": "https://github.com/NDDev-it-com/rldyour-claudecode/tree/main/plugins/rldyour-flow",
  "repository": "https://github.com/NDDev-it-com/rldyour-claudecode",
  "keywords": [
    "sdlc",
    "workflow",
    "ry-init",
    "ry-start",
    "ry-newp",
    "ry-review",
    "ry-repair",
    "ry-deploy",
    "ry-sync",
    "reviewer",
    "post-task-sync",
    "instruction-docs",
    "rldyour"
  ],
  "dependencies": [
    "rldyour-mcps",
    "rldyour-serena-mcp"
  ]
}
