{
  "$schema": "https://json.schemastore.org/claude-code-plugin-manifest.json",
  "name": "rldyour-design",
  "version": "1.8.12",
  "description": "Дизайн-воркфлоу для Claude Code: Figma → код, централизованные токены (W3C DTCG/Tailwind v4), строгий FSD, shadcn/ui, ReactBits + браузер-валидация. Skills-only - MCP-транспорт (Figma, shadcn, Playwright, Chrome DevTools) берётся из rldyour-mcps.",
  "author": {
    "name": "Danil Silantyev (github:rldyourmnd), CEO NDDev",
    "url": "https://github.com/rldyourmnd"
  },
  "license": "AGPL-3.0-or-later",
  "homepage": "https://github.com/NDDev-it-com/rldyour-claudecode/tree/main/plugins/rldyour-design",
  "repository": "https://github.com/NDDev-it-com/rldyour-claudecode",
  "keywords": [
    "design",
    "figma",
    "shadcn",
    "reactbits",
    "fsd",
    "feature-sliced-design",
    "design-system",
    "tokens",
    "tailwind",
    "ui-implementation",
    "pixel-perfect",
    "rldyour"
  ],
  "dependencies": [
    "rldyour-mcps",
    "rldyour-browser"
  ]
}
