{
  "$schema": "https://json.schemastore.org/claude-code-plugin-manifest.json",
  "name": "rldyour-browser",
  "version": "1.8.13",
  "description": "Fail-closed CloakBrowser workflows through exact managed Playwright CLI and Chrome DevTools MCP transports. Every action is health-gated; Webwright runtime and browser fallbacks are forbidden.",
  "author": {
    "name": "Danil Silantyev (github:rldyourmnd), CEO NDDev",
    "url": "https://github.com/rldyourmnd"
  },
  "license": "AGPL-3.0-or-later",
  "homepage": "https://github.com/NDDev-it-com/rldyour-claudecode/tree/main/plugins/rldyour-browser",
  "repository": "https://github.com/NDDev-it-com/rldyour-claudecode",
  "keywords": [
    "browser",
    "playwright",
    "chrome-devtools",
    "mcp",
    "ui-validation",
    "pixel-perfect",
    "responsive",
    "screenshots",
    "browser-debug",
    "browser-validation",
    "rldyour"
  ],
  "dependencies": [
    "rldyour-mcps"
  ]
}
