{
  "$schema": "https://json.schemastore.org/claude-code-plugin-manifest.json",
  "name": "rldyour-serena-mcp",
  "version": "1.8.14",
  "description": "Серена-первый воркфлоу для кода + синхронизация .serena памяти + prompt/tool marker hooks (UserPromptSubmit/PreToolUse/PostToolUse). Stop orchestration belongs to rldyour-flow. Транспорт Serena MCP берётся из rldyour-mcps.",
  "author": {
    "name": "Danil Silantyev (github:rldyourmnd), CEO NDDev",
    "url": "https://github.com/rldyourmnd"
  },
  "license": "AGPL-3.0-or-later",
  "homepage": "https://github.com/NDDev-it-com/rldyour-claudecode/tree/main/plugins/rldyour-serena-mcp",
  "repository": "https://github.com/NDDev-it-com/rldyour-claudecode",
  "keywords": [
    "serena",
    "mcp",
    "lsp",
    "semantic-code",
    "code-workflow",
    "memories",
    "hooks",
    "rldyour"
  ],
  "dependencies": [
    "rldyour-mcps"
  ]
}
