{
  "$schema": "https://json.schemastore.org/claude-code-plugin-manifest.json",
  "name": "rldyour-security",
  "version": "1.8.13",
  "description": "Безопасность по OWASP Top 10 2025 при реализации + защитный Mythos-style security review через /ry-sec-review. Skills-only auto-invoked guidance для Claude Code.",
  "author": {
    "name": "Danil Silantyev (github:rldyourmnd), CEO NDDev",
    "url": "https://github.com/rldyourmnd"
  },
  "license": "AGPL-3.0-or-later",
  "homepage": "https://github.com/NDDev-it-com/rldyour-claudecode/tree/main/plugins/rldyour-security",
  "repository": "https://github.com/NDDev-it-com/rldyour-claudecode",
  "keywords": [
    "security",
    "owasp",
    "asvs",
    "secure-code-review",
    "vulnerability-review",
    "defensive-security",
    "ry-sec-review",
    "rldyour"
  ],
  "dependencies": [
    "rldyour-mcps"
  ]
}
