{
  "$schema": "https://json.schemastore.org/claude-code-plugin-manifest.json",
  "name": "rldyour-explore",
  "version": "1.8.11",
  "description": "Скиллы технического и веб-исследования + ry-explore субагент глубокого анализа (Opus 4.8 1M via opus[1m], max effort) через Context7/DeepWiki/Grep MCP. Auto-invoked skills + /ry-explore slash command для явного вызова.",
  "author": {
    "name": "Danil Silantyev (github:rldyourmnd), CEO NDDev",
    "url": "https://github.com/rldyourmnd"
  },
  "license": "AGPL-3.0-or-later",
  "homepage": "https://github.com/NDDev-it-com/rldyour-claudecode/tree/main/plugins/rldyour-explore",
  "repository": "https://github.com/NDDev-it-com/rldyour-claudecode",
  "keywords": [
    "research",
    "explore",
    "context7",
    "deepwiki",
    "grep",
    "rldyour"
  ],
  "dependencies": [
    "rldyour-mcps"
  ]
}
