{
  "$schema": "https://json.schemastore.org/claude-code-plugin-manifest.json",
  "name": "rldyour-rules",
  "version": "1.8.11",
  "description": "Quality-first инженерные правила для Claude Code: clean architecture (FSD/VSA/Hexagonal), implementation discipline, dependency policy + supply chain (SLSA L2), verification gates (pyright/ruff/ESLint v9), AGENTS.md/.claude/CLAUDE.md, ADR (MADR 4.0.0), ry-rules-review.",
  "author": {
    "name": "Danil Silantyev (github:rldyourmnd), CEO NDDev",
    "url": "https://github.com/rldyourmnd"
  },
  "license": "AGPL-3.0-or-later",
  "homepage": "https://github.com/NDDev-it-com/rldyour-claudecode/tree/main/plugins/rldyour-rules",
  "repository": "https://github.com/NDDev-it-com/rldyour-claudecode",
  "keywords": [
    "rules",
    "quality",
    "clean-architecture",
    "fsd",
    "vsa",
    "hexagonal",
    "verification",
    "dependency-policy",
    "supply-chain",
    "adr",
    "rldyour"
  ],
  "dependencies": [
    "rldyour-mcps"
  ]
}
