{
  "$schema": "https://json.schemastore.org/claude-code-plugin-manifest.json",
  "name": "rldyour-lsps",
  "version": "1.8.14",
  "description": "LSP-воркфлоу для Claude Code: маршрутизация, health-checks, brew-first установка, Serena LSP integration. Skills + scripts + references. Покрывает Python, Rust, Dart/Flutter, TS/JS, Go, C/C++, Qt, YAML, Docker, HTML/CSS, Shell, JSON, TOML, Markdown.",
  "author": {
    "name": "Danil Silantyev (github:rldyourmnd), CEO NDDev",
    "url": "https://github.com/rldyourmnd"
  },
  "license": "AGPL-3.0-or-later",
  "homepage": "https://github.com/rldyourmnd/rldyour-claudecode/tree/main/plugins/rldyour-lsps",
  "repository": "https://github.com/rldyourmnd/rldyour-claudecode",
  "keywords": [
    "lsp",
    "language-server",
    "serena",
    "pyright",
    "typescript-language-server",
    "rust-analyzer",
    "gopls",
    "clangd",
    "qmlls",
    "yaml-language-server",
    "bash-language-server",
    "rldyour"
  ],
  "dependencies": [
    "rldyour-mcps"
  ]
}
